{
  "$schema": "../../../../schemas/agent-launch-requirements-impact-map.schema.json",
  "analysis_id": "ALRA-2026-001",
  "analysis_role": "historical_snapshot",
  "status": "completed",
  "source_change_order": "CO-2026-002",
  "story_range": {
    "from": "DC-ST-23",
    "to": "DC-ST-33"
  },
  "requirements_baseline": {
    "source_path": "docs/product/requirements/business-requirements.md",
    "confirmed_existing_range": "BT-001..BT-021",
    "next_free_requirement_id": "BT-022",
    "new_requirement_ids_assigned": [
      "BT-019",
      "BT-020",
      "BT-021"
    ]
  },
  "stories": [
    {
      "story_id": "DC-ST-23",
      "title": "Передача запроса на подготовку презентации от другого агента",
      "decision_id": "ALRA-DEC-001",
      "decision_type": "no_change_existing_requirements_sufficient",
      "requirement_action": "no_new_requirement",
      "affected_requirements": [
        "BT-015",
        "BT-016",
        "BT-014"
      ],
      "source_paths": [
        "docs/product/change-orders/co-2026-002-agent-launch-delivery-scope.md",
        "docs/product/requirements/user-stories.md",
        "docs/product/backlog/agent-launch-candidate-stories-2026-q3.md",
        "docs/product/requirements/business-requirements.md"
      ],
      "rationale": "Прием запроса, связь с входным пакетом и трассировка маршрута уже покрыты текущими требованиями после CO-2026-002.",
      "acceptance_criteria_effect": "Используются текущие критерии для запуска другим агентом: запрос принят, вход проверен, пользовательское подтверждение не требуется.",
      "traceability_effect": "Связь проходит через BT-015, BT-016 и BT-014.",
      "evidence_status": "sufficient",
      "blockers": []
    },
    {
      "story_id": "DC-ST-24",
      "title": "Запуск DataCanvas в общем сценарии с другими агентами",
      "decision_id": "ALRA-DEC-002",
      "decision_type": "no_change_existing_requirements_sufficient",
      "requirement_action": "no_new_requirement",
      "affected_requirements": [
        "BT-015",
        "BT-014"
      ],
      "source_paths": [
        "docs/product/change-orders/co-2026-002-agent-launch-delivery-scope.md",
        "docs/product/requirements/user-stories.md",
        "docs/product/backlog/agent-launch-candidate-stories-2026-q3.md",
        "docs/product/requirements/business-requirements.md"
      ],
      "rationale": "История уточняет общий агентский контекст и не добавляет отдельную бизнесовую границу сверх приема запроса другим агентом и трассировки.",
      "acceptance_criteria_effect": "Критерии остаются разделенными: запуск другим агентом идет без подтверждения, режим Лисы остается отдельным маршрутом.",
      "traceability_effect": "Связь проходит через BT-015 и BT-014.",
      "evidence_status": "sufficient",
      "blockers": []
    },
    {
      "story_id": "DC-ST-25",
      "title": "Входной пакет с задачей, источником запроса, параметрами презентации и данными для определения получателя результата",
      "decision_id": "ALRA-DEC-003",
      "decision_type": "no_change_existing_requirements_sufficient",
      "requirement_action": "no_new_requirement",
      "affected_requirements": [
        "BT-016",
        "BT-006"
      ],
      "source_paths": [
        "docs/product/change-orders/co-2026-002-agent-launch-delivery-scope.md",
        "docs/product/requirements/user-stories.md",
        "docs/product/backlog/agent-launch-candidate-stories-2026-q3.md",
        "docs/product/requirements/business-requirements.md"
      ],
      "rationale": "Бизнесовый состав входного пакета от другого агента покрыт обновленным BT-016, а проверка недоверенного входа покрыта BT-006.",
      "acceptance_criteria_effect": "Невалидный, недостаточный пакет или пакет без данных для определения получателя результата не идет в генерацию и доставку.",
      "traceability_effect": "Связь проходит через BT-016 и BT-006.",
      "evidence_status": "sufficient",
      "blockers": []
    },
    {
      "story_id": "DC-ST-26",
      "title": "Проверка входного пакета от другого агента",
      "decision_id": "ALRA-DEC-004",
      "decision_type": "no_change_existing_requirements_sufficient",
      "requirement_action": "no_new_requirement",
      "affected_requirements": [
        "BT-017",
        "BT-006",
        "BT-013"
      ],
      "source_paths": [
        "docs/product/change-orders/co-2026-002-agent-launch-delivery-scope.md",
        "docs/product/requirements/user-stories.md",
        "docs/product/backlog/agent-launch-candidate-stories-2026-q3.md",
        "docs/product/requirements/business-requirements.md",
        "docs/product/requirements/acceptance-criteria.md"
      ],
      "rationale": "Проверка достаточности и безопасности входа покрыта BT-017; общая проверка недоверенного входа и защита от опасных данных покрыты BT-006 и BT-013.",
      "acceptance_criteria_effect": "Недостаточный или небезопасный вход останавливает маршрут до генерации и отправки файлов.",
      "traceability_effect": "Связь проходит через BT-017, BT-006 и BT-013.",
      "evidence_status": "sufficient",
      "blockers": []
    },
    {
      "story_id": "DC-ST-27",
      "title": "Сообщение о приеме данных, статусы обработки и сведения о результате",
      "decision_id": "ALRA-DEC-005",
      "decision_type": "no_change_existing_requirements_sufficient",
      "requirement_action": "no_new_requirement",
      "affected_requirements": [
        "BT-018",
        "BT-012",
        "BT-014"
      ],
      "source_paths": [
        "docs/product/change-orders/co-2026-002-agent-launch-delivery-scope.md",
        "docs/product/requirements/user-stories.md",
        "docs/product/backlog/agent-launch-candidate-stories-2026-q3.md",
        "docs/product/requirements/business-requirements.md",
        "docs/architecture/system-analysis/datacanvas-lifecycle-state-model.md"
      ],
      "rationale": "Статусы обработки и сведения о результате покрыты BT-018, доставка готовых файлов пользователю покрыта BT-012, проверяемая связь покрыта BT-014.",
      "acceptance_criteria_effect": "Вызывающий агент получает проверяемые сведения о статусе, а готовые файлы доставляются пользователю по электронной почте.",
      "traceability_effect": "Связь проходит через BT-018, BT-012 и BT-014.",
      "evidence_status": "sufficient",
      "blockers": []
    },
    {
      "story_id": "DC-ST-28",
      "title": "Проверяемая связь источника запроса, результата проверки, статусов и итоговых файлов",
      "decision_id": "ALRA-DEC-006",
      "decision_type": "no_change_existing_requirements_sufficient",
      "requirement_action": "no_new_requirement",
      "affected_requirements": [
        "BT-014",
        "BT-018"
      ],
      "source_paths": [
        "docs/product/change-orders/co-2026-002-agent-launch-delivery-scope.md",
        "docs/product/requirements/user-stories.md",
        "docs/product/backlog/agent-launch-candidate-stories-2026-q3.md",
        "docs/product/requirements/business-requirements.md",
        "docs/product/requirements/traceability-matrix.json"
      ],
      "rationale": "Проверяемость маршрута покрыта BT-014, а статусы обработки и сведения о результате покрыты BT-018.",
      "acceptance_criteria_effect": "Для каждого результата можно восстановить источник запроса, проверку, статусы и связь с итоговыми файлами.",
      "traceability_effect": "Связь проходит через BT-014, BT-018 и текущую Traceability.",
      "evidence_status": "sufficient",
      "blockers": []
    },
    {
      "story_id": "DC-ST-29",
      "title": "Генерация редактируемого PPTX-файла и нередактируемой PDF-копии",
      "decision_id": "ALRA-DEC-007",
      "decision_type": "no_change_existing_requirements_sufficient",
      "requirement_action": "no_new_requirement",
      "affected_requirements": [
        "BT-012",
        "BT-002",
        "BT-014"
      ],
      "source_paths": [
        "docs/product/change-orders/co-2026-002-agent-launch-delivery-scope.md",
        "docs/product/requirements/user-stories.md",
        "docs/product/backlog/agent-launch-candidate-stories-2026-q3.md",
        "docs/product/requirements/business-requirements.md",
        "docs/product/requirements/acceptance-criteria.md",
        "docs/product/requirements/traceability-matrix.json"
      ],
      "rationale": "Генерация проверяемой презентации покрыта BT-002, подготовка и доставка файлов покрыты BT-012, связь с маршрутом и результатом покрыта BT-014.",
      "acceptance_criteria_effect": "DataCanvas формирует редактируемый PPTX-файл и нередактируемую PDF-копию из проверенных и нормализованных данных до отправки пользователю.",
      "traceability_effect": "Связь проходит через BT-012, BT-002 и BT-014.",
      "evidence_status": "sufficient",
      "blockers": []
    },
    {
      "story_id": "DC-ST-30",
      "title": "Расширенная электронная доставка созданных файлов в разрешенные рабочие контуры",
      "decision_id": "ALRA-DEC-008",
      "decision_type": "create_new_requirement",
      "requirement_action": "create_new_requirement",
      "affected_requirements": [
        "BT-019",
        "BT-014"
      ],
      "source_paths": [
        "docs/product/change-orders/co-2026-002-agent-launch-delivery-scope.md",
        "docs/product/requirements/user-stories.md",
        "docs/product/backlog/agent-launch-candidate-stories-2026-q3.md",
        "docs/product/requirements/business-requirements.md",
        "docs/product/requirements/acceptance-criteria.md"
      ],
      "rationale": "Для расширенной доставки нужен отдельный BT-019, потому что она меняет границу доставки за пределами основного P1-маршрута.",
      "acceptance_criteria_effect": "Созданные файлы доставляются в разрешенные рабочие контуры как отдельный P2-этап дорожной карты.",
      "traceability_effect": "Связь проходит через BT-019 и BT-014.",
      "evidence_status": "sufficient",
      "blockers": []
    },
    {
      "story_id": "DC-ST-31",